연번,사업장,프로그램명,프로그램 분야,프로그램 설명
234,연희노인문화센터,사물놀이,복지,"전통가락에 맞춰 장구, 북 등 합주 교육"
235,연희노인문화센터,난타,복지,난타 정박과 엇박의 터치리듬 퍼포먼스 교육
236,연희노인문화센터,미술반,복지,"수채화 어반스케치, 드로잉펜 미술 교육"
237,연희노인문화센터,한글서예,복지,한글서예 붓글씨 교육
238,연희노인문화센터,한자서예,복지,한자서예 붓글씨 교육
239,연희노인문화센터,문인화,복지,매난국죽 문인화 교육
240,연희노인문화센터,기타초급,복지,"기타초급 코드, 주법 교육"
241,연희노인문화센터,기타중급,복지,"기타중급 코드, 주법 교육"
242,연희노인문화센터,합창,복지,피아노 반주에 맞춰 가곡 합창 교육
243,연희노인문화센터,한국무용,복지,한국의 전통성을 살려 창작한 한국무용 교육
244,연희노인문화센터,생활도예,복지,도자기 소품 만들기 교육
245,연희노인문화센터,캘리그라피,복지,다양한 도구를 활용한 여러가지 글꼴표현기법 교육
246,연희노인문화센터,맷돌체조,복지,맷돌방향 기의 흐름 체조 교육
247,연희노인문화센터,실버요가 1반,복지,몸의 균형을 잡을 수 있는 요가 교육
248,연희노인문화센터,웃음교실,복지,뇌건강 웃음 레크리에이션 운동교육
249,연희노인문화센터,실버요가 2반,복지,건강한 몸과 마음을 만드는 요가 교육
250,연희노인문화센터,건강체조,복지,노인의 특성을 고려한 건강체조 교육
251,연희노인문화센터,기체조,복지,"기의 흐름과 호흡법, 기체조 교육"
252,연희노인문화센터,시니어로빅,복지,노인의 특성에 맞춘 시니어 에어로빅 교육
253,연희노인문화센터,실버요가A 특강,복지,노인의 특성에 맞춘 시니어 에어로빅 교육
254,연희노인문화센터,실버요가B 특강,복지,건강한 몸과 마음을 만드는 요가 교육 특강
255,연희노인문화센터,힐링댄스 작품특강,복지,신나는 노래에 맞춘 힐링 댄스 교육 특강
256,연희노인문화센터,어르신 검도교실,복지,노인 건강증진을 위한 생활체육 검도 교육
257,연희노인문화센터,노인건강체조교실,복지,노인 건강증진을 위한 건강체조 교육
258,연희노인문화센터,컴퓨터초급,복지,컴퓨터 윈도우 기본조작법 교육
259,연희노인문화센터,한글과파워포인트,복지,문서작성법교육
260,연희노인문화센터,인터넷활용,복지,"인터넷검색, 메일발송 등 교육"
261,연희노인문화센터,사진편집,복지,"사진편집, 키네마스터 영상제작 등 교육"
262,연희노인문화센터,한글문서작성기초,복지,"아래한글, 문서꾸미기, 표만들기 교육"
263,연희노인문화센터,컴퓨터왕초보,복지,"컴퓨터 기본구성, 윈도우, 인터넷 등 교육"
264,연희노인문화센터,스마트폰기초,복지,"스마트폰 기본기능, SNS, 교통어플, 모바일쇼핑 등 교육"
265,연희노인문화센터,스마트폰활용A,복지,"SNS, 모바일쇼핑, 키오스크, 줌사용법 등 교육"
266,연희노인문화센터,스마트폰활용B,복지,"SNS, 모바일쇼핑, 키오스크, 줌사용법 등 교육"
267,연희노인문화센터,스마트폰영상편집A,복지,"사진어플, 영상 인코딩, GIF만들기 등 교육"
268,연희노인문화센터,스마트폰영상편집B,복지,"사진어플, 영상 인코딩, GIF만들기 등 교육"
269,연희노인문화센터,컴맹탈출,복지,"컴퓨터 기초과정, 컴퓨터 입문자를 위한 기초교육"
270,연희노인문화센터,한글문서작성중급,복지,한글문서작성 중급과정 교육
271,연희노인문화센터,사진&파워포인트,복지,사진과 파워포인트 맛보기 교육
272,연희노인문화센터,카톡&사진완전정복,복지,"스마트폰 카톡사용법, 사진꾸미기 교육"
273,연희노인문화센터,유튜브크리에이터,복지,스마트폰 유튜브 영상편집 및 업로드 교육
274,연희노인문화센터,스마트폰중급,복지,스마트폰 중급과정 교육
